<?xml version="1.0" encoding="UTF-8"?>
<!DOCTYPE auton SYSTEM "auton.dtd">
<auton>

  <primitive id= "RESET_POSITION_PATH_PLANNER"
                pathname= "BluePodiumWing2Center2Start"
                noteOption="STATE_READY_ODOMETRY_LAUNCH"/>

<zone ygrid1="Y_11"
            xgrid1="X_Q"
            ygrid2="Y_13"
            xgrid2="X_S"
            noteOption="STATE_AUTO_LAUNCH_ODOMETRY"/>

<snippet file= "ShootWhenStopAuto"/>

<primitive id= "DRIVE_PATH_PLANNER" 
pathname= "BluePodiumWing2Center2Start"
noteOption= "STATE_READY_AUTO_LAUNCH"
time= "0.5"/>

<snippet file= "ShootWhenStopAuto.xml"/>

<primitive id= "DRIVE_PATH_PLANNER" 
pathname= "BluePodiumWing2Center2_A"
noteOption= "STATE_FEEDER_INTAKE"
time= "2.0"/>

<snippet file= "ShootWhenStopAuto.xml"/>

<primitive id= "DRIVE_PATH_PLANNER" 
pathname= "BluePodiumWing2Center2_B"
noteOption= "STATE_FEEDER_INTAKE"
time= "2.0"/>

<primitive id= "DRIVE_TO_NOTE"
noteOption= "STATE_FEEDER_INTAKE"/>

<primitive id= "DRIVE_PATH_PLANNER" 
pathname= "BluePodiumWing2Center2_C"
noteOption= "STATE_FEEDER_INTAKE"
time= "3.0"/>

<snippet file= "ShootWhenStopAuto.xml"/>

<primitive id= "DRIVE_PATH_PLANNER" 
pathname= "BluePodiumWing2Center2_D"
noteOption= "STATE_FEEDER_INTAKE"
time= "3.0"/>


<primitive id= "DRIVE_PATH_PLANNER" 
pathname= "BluePodiumWing2Center2_E"
noteOption= "STATE_FEEDER_INTAKE"
time= "3.0"/>

<snippet file= "ShootWhenStopAuto.xml"/>

</auton>