<?xml version="1.0" encoding="UTF-8"?>
<!DOCTYPE auton SYSTEM "auton.dtd">
<auton>
    <primitive id="RESET_POSITION"
               pathname="BlueWallOne1.wpilib.json"
               intake="INTAKE_HOLD"/>
    <!--score preloaded cone-->
    <snippet file="ScoreCone.xml"/>
    <!--drive to charing station-->
    <primitive id="DRIVE_PATH"
               pathname="BlueWallOne1.wpilib.json"
               headingOption="SPECIFIED_ANGLE"
               heading="180"
               intake="INTAKE"
               time="0.8"
               />
    <primitive id="DRIVE_PATH"
               pathname="BlueWallOne4.wpilib.json"
               headingOption="SPECIFIED_ANGLE"
               heading="0"
               intake="INTAKE"
               time="1.0"
               />
    <primitive id="DRIVE_PATH"
               pathname="BlueWallOne2Slow.wpilib.json"
               headingOption="SPECIFIED_ANGLE"
               heading="0"
               intake="INTAKE"
               time="3.5"
               />
    <primitive id="DRIVE_PATH"
               pathname="BlueWallTwo1.wpilib.json"
               headingOption="SPECIFIED_ANGLE"
               heading="0"
               intake="INTAKE"
               time="1.5"
               />
    <!--pick up cube-->
    <primitive id="DO_NOTHING"
               headingOption="SPECIFIED_ANGLE"
               heading="0"
               intake="INTAKE"
               time="1.0"
               />
    <primitive id="DO_NOTHING"
               headingOption="SPECIFIED_ANGLE"
               heading="0"
               intake="INTAKE"
               time="0.4"
               />
    <primitive id="DO_NOTHING"
               headingOption="SPECIFIED_ANGLE"
               heading="0"
               intake="INTAKE"
               time="0.4"
               />
   <!--drive to scoring station-->
    <primitive id="DRIVE_PATH"
               pathname="BlueWallTwo4.wpilib.json"
               headingOption="SPECIFIED_ANGLE"
               heading="180"
               intake="HOLD"
               time="6.0"
               />
   <!--score cube-->
    <primitive id="DO_NOTHING"
               intake="HOLD"
               time="0.6"
               />
    <primitive id="DO_NOTHING"
               intake="HOLD"
               time="0.35"
               />
    <primitive id="DO_NOTHING"
               intake="HOLD"
               time="0.5"
               />
    <primitive id="DO_NOTHING"
               intake="HOLD"
               time="0.5"
               />
   <primitive id="DO_NOTHING"
               intake="INTAKE_RELEASE"
               time="0.5"
               />
</auton>