<?xml version="1.0" encoding="UTF-8"?>
<!DOCTYPE auton SYSTEM "auton.dtd">
<auton>
    <primitive id="RESET_POSITION"
	           pathname="RedCOOPOne1CubeSlow.wpilib.json"
               intake="INTAKE_HOLD"/>
    <!--score preloaded cone-->
    <snippet file="ScoreCone.xml"/> 
    <!--drive over charging station-->
    <primitive id="DRIVE_PATH"
               pathname="RedCOOPOne1CubeSlow.wpilib.json"
               headingOption="SPECIFIED_ANGLE"
               heading="0"
               arm="FLOOR_POSITION_ROTATE"
               extender="STARTING_POSITION_EXTEND"
               intake="INTAKE_OFF"
               time="6.0"
               />
    <!--drive picking up a cube after the charging station-->
    <primitive id="DRIVE_PATH"
               pathname="RedCOOPTwo1Slow.wpilib.json"
               headingOption="SPECIFIED_ANGLE"
               heading="180"
               arm="FLOOR_POSITION_ROTATE"
               extender="FLOOR_EXTEND"
               intake="INTAKE"
               time="1.25"
               />
 <!--grab cube-->
<primitive id="VISION_ALIGN"
               pipeline="CUBE"
               arm="FLOOR_POSITION_ROTATE"
               extender="FLOOR_EXTEND"
               intake="INTAKE"
               time="1.0"
               />
    <!--drive onto charging station-->
    <primitive id="DRIVE_PATH"
               pathname="RedCOOPTwo2Slow.wpilib.json"
               headingOption="SPECIFIED_ANGLE"
               heading="0"
               arm="FLOOR_POSITION_ROTATE"
               extender="STARTING_POSITION_EXTEND"
               intake="INTAKE_HOLD_CUBE"
               time="3.0"
               />
    <!--laumch cube-->
    <primitive id="AUTO_BALANCE"
               headingOption="FACE_APRIL_TAG"
               arm="CUBE_BACKROW_ROTATE"
               extender="STARTING_POSITION_EXTEND"
               intake="INTAKE_HOLD_CUBE"
               time="0.65"
               />
    <primitive id="AUTO_BALANCE"
               headingOption="FACE_APRIL_TAG"
               arm="CUBE_BACKROW_ROTATE"
               extender="STARTING_POSITION_EXTEND"
               intake="INTAKE_EXPEL"
               time="0.25"
               />
    <!--auto balance-->
    <primitive id="AUTO_BALANCE"
               headingOption="SPECIFIED_ANGLE"
               heading="0"
               arm="FLOOR_POSITION_ROTATE_AUTON"
               extender="STARTING_POSITION_EXTEND"
               intake="INTAKE_HOLD_CUBE"
               time="10.0"
               />
</auton>