<?xml version="1.0" encoding="UTF-8"?>
<!DOCTYPE auton SYSTEM "auton.dtd">
<auton>
<primitive id="RESET_POSITION_PATH_PLANNER"
	           pathname="RedHP1"
			/>
    <!--score preloaded cone-->
    <snippet file="ScoreCone.xml"/>
    <!--drive to cube-->
<primitive id="DRIVE_PATH_PLANNER"
	           pathname="RedHP1"
			   arm="FLOOR_POSITION_ROTATE_AUTON"
               intake="INTAKE_OFF"
			   extender="STARTING_POSITION_EXTEND"
               time="2.25"/>
<primitive id="DO_NOTHING"
			   arm="FLOOR_POSITION_ROTATE"
               intake="INTAKE"
			   extender="FLOOR_EXTEND"
               time="0.25"/>
<primitive id="DRIVE_PATH_PLANNER"
	           pathname="RedHP2"
			   arm="FLOOR_POSITION_ROTATE"
               intake="INTAKE"
			   extender="FLOOR_EXTEND"
               time="2.40"/>
<!--drive to scoring station-->
<primitive id="DRIVE_PATH_PLANNER"
	           pathname="RedHP3"
			   arm="FLOOR_POSITION_ROTATE"
               intake="INTAKE_HOLD_CUBE"
			   extender="STARTING_POSITION_EXTEND"
               time="3.0"/>
<!--score cube-->
        <snippet file="ScoreHighCube.xml"/>
<!--drive to cone-->
<primitive id="DRIVE_PATH_PLANNER"
	        pathname="RedHP5"
			arm="FLOOR_POSITION_ROTATE"
            intake="INTAKE"
			extender="FLOOR_EXTEND"
            time="2.85"/>
</auton>