<?xml version="1.0" encoding="UTF-8"?>
<!DOCTYPE auton SYSTEM "auton.dtd">

<auton>

<primitive id= "RESET_POSITION_PATH_PLANNER_NO_VISION"
pathname= "BlueSubwooferWing2Center2_A"/>

<snippet file= "ShootWhenStopManual.xml"/>

<primitive id= "DRIVE_PATH_PLANNER"
pathname= "BlueSubwooferWing2Center2_A"
time= "3.0"
noteOption="STATE_FEEDER_INTAKE"/>
 
<!-- <primitive id= "DRIVE_PATH_PLANNER"
pathname= "DRIVE_TO_NOTE"
noteOption="STATE_FEEDER_INTAKE"
pathgains= "ShortPath"/> -->

<snippet file= "ShootWhenStopAuto.xml"/>

<primitive id= "DRIVE_PATH_PLANNER"
pathname= "BlueSubwooferWing2Center2_B"
time= "3.0"
noteOption="STATE_FEEDER_INTAKE"/>

<primitive id= "DRIVE_PATH_PLANNER"
pathname= "DRIVE_TO_NOTE"
noteOption="STATE_FEEDER_INTAKE"
pathgains= "ShortPath"/>

<primitive id= "DRIVE_PATH_PLANNER"
pathname= "BlueSubwooferWing2Center2_C"
time= "3.0"
noteOption="STATE_FEEDER_INTAKE"/>

<snippet file= "ShootWhenStopAuto.xml"/>

<primitive id= "DRIVE_PATH_PLANNER"
pathname= "BlueSubwooferWing2Center2_D"
time= "3.0"
noteOption="STATE_FEEDER_INTAKE"/>

<primitive id= "DRIVE_PATH_PLANNER"
pathname= "BlueSubwooferWing2Center2_E"
time= "3.0"
noteOption="STATE_FEEDER_INTAKE"/>

<snippet file= "ShootWhenStopAuto.xml"/>

</auton>