<?xml version="1.0" encoding="UTF-8"?>
<!DOCTYPE auton SYSTEM "auton.dtd">
<auton>

<primitive id= "RESET_POSITION_PATH_PLANNER"
        pathname= "BlueAmpWing1Center0"
        noteOption="STATE_HOLD_FEEDER"/>

<primitive id= "DRIVE_PATH_PLANNER"
    pathname= "BlueAmpWing1Center0"
    time= "0.5"
noteOption="STATE_HOLD_FEEDER"
/>

<primitive id= "DO_NOTHING"
    pathname= "BlueAmpWing1Center0"
    time= "0.35"
noteOption="STATE_READY"
/>
<!-- visionAligment = "SPEAKER"/> -->

<snippet file= "ShootWhenStopAuto.xml"/>

<primitive id= "DRIVE_PATH_PLANNER"
pathname= "BlueAmpWing1Center0_1"
time= "2.5"
noteOption="STATE_FEEDER_INTAKE"
pathgains = "ShortPath"/>
<!--visionAligment = "SPEAKER"/>-->

<snippet file= "ShootWhenStopAuto.xml"/>

<primitive id= "DRIVE_PATH_PLANNER"
pathname= "BlueAmpWing1Center1_1B"
time= "5.1"
noteOption="STATE_FEEDER_INTAKE"/>
<!--visionAligment = "SPEAKER"/>-->

<snippet file= "ShootWhenStopAuto.xml"/>

<primitive id= "DRIVE_PATH_PLANNER"
pathname= "BlueAmpWing1Center0_1C"
time= "5.6"
noteOption="STATE_PLACER_INTAKE"/>
<!--visionAligment = "SPEAKER"/>-->

</auton>