<?xml version="1.0" encoding="UTF-8"?>
<!DOCTYPE auton SYSTEM "auton.dtd">
<auton>

<primitive id= "RESET_POSITION_PATH_PLANNER"
        pathname= "BlueAmpWing1Center0"
        noteOption="STATE_READY_AUTO_LAUNCH"/>

<primitive id= "DRIVE_PATH_PLANNER"
    pathname= "BlueAmpWing1Center0"
    time= "1.0"
noteOption="STATE_READY_AUTO_LAUNCH"/>
<!-- visionAligment = "SPEAKER"/> -->

<snippet file= "ShootWhenStopAuto.xml"/>

<primitive id= "DRIVE_PATH_PLANNER"
pathname= "BlueAmpWing1Center0_1"
time= "1.2"
noteOption="STATE_FEEDER_INTAKE"/>
<!--visionAligment = "SPEAKER"/>-->

<snippet file= "ShootWhenStopAuto.xml"/>

<primitive id= "DRIVE_PATH_PLANNER"
pathname= "BlueAmpWing1Center1_1B"
time= "5.1"
noteOption="STATE_FEEDER_INTAKE"/>
<!--visionAligment = "SPEAKER"/>-->

<snippet file= "ShootWhenStopAuto.xml"/>

<primitive id= "DRIVE_PATH_PLANNER"
pathname= "BlueAmpWing1Center0_1C"
time= "6.0"
noteOption="STATE_FEEDER_INTAKE"/>
<!--visionAligment = "SPEAKER"/>-->
<primitive id="DO_NOTHING"
time="0.25"
noteOption="STATE_READY_AUTO_LAUNCH"/>

<snippet file= "ShootWhenStopAuto.xml"/>

</auton>