<?xml version="1.0" encoding="UTF-8"?>
<!DOCTYPE auton SYSTEM "auton.dtd">
<auton>

<primitive id= "RESET_POSITION_PATH_PLANNER"
pathname= "BluePodiumWing3Center1_A"/>

<primitive id= "DO_NOTHING"
time= "0.5"
noteOption= "STATE_READY_ODOMETRY_LAUNCH"
headingOption = "FACE_SPEAKER"/>


<snippet file= "ShootWhenStopAuto.xml"/>

<primitive id= "DRIVE_PATH_PLANNER"
pathname= "BluePodiumWing3Center1_A"
time = "3.0"
noteOption="STATE_FEEDER_INTAKE"
pathgains = "ShortPath"
visionAligment= "SPEAKER"/>

<snippet file= "ShootWhenStopAuto.xml"/> 

<primitive id= "DRIVE_PATH_PLANNER"
pathname= "BluePodiumWing3Center1B"
time = "3.5"
pathUpdateOption = "NOTE"
noteOption="STATE_FEEDER_INTAKE"
/>

<primitive id= "DRIVE_PATH_PLANNER"
pathname= "BluePodiumWing3Center1_C"
time = "3.0"
noteOption="STATE_HOLD_FEEDER"
visionAligment= "SPEAKER"/>

<snippet file= "ShootWhenStopAuto.xml"/> 

<primitive id= "DRIVE_PATH_PLANNER"
pathname= "BluePodiumWing3Center1_D"
time = "1.5"
noteOption="STATE_FEEDER_INTAKE"
pathgains = "ShortPath"
visionAligment= "SPEAKER"/>

<snippet file= "ShootWhenStopAuto.xml"/> 


<primitive id= "DRIVE_PATH_PLANNER"
pathname= "BluePodiumWing3Center1_E"
time = "2.0"
noteOption="STATE_FEEDER_INTAKE"
pathgains = "ShortPath"
visionAligment= "SPEAKER"/>

<snippet file= "ShootWhenStopAuto.xml"/> 


</auton>