<?xml version="1.0" encoding="UTF-8"?>
<!DOCTYPE auton SYSTEM "auton.dtd">
<auton>

<primitive id= "RESET_POSITION_PATH_PLANNER_NO_VISION"
            pathname= "RedPodiumWing1Center2_A"
                noteOption="STATE_HOLD_FEEDER"/>

<primitive id= "DRIVE_PATH_PLANNER"
pathname= "BluePodiumWing1Center2_1A"
time= "0.8"
noteOption="STATE_READY_AUTO_LAUNCH"/>

<snippet file= "ShootWhenStopAuto.xml"/>

<primitive id= "DRIVE_PATH_PLANNER"
pathname= "RedPodiumWing1Center2_A"
time= "1.2"
noteOption="STATE_FEEDER_INTAKE"/>


<primitive id="DO_NOTHING"
time="0.8"
noteOption="STATE_FEEDER_INTAKE"/>


<snippet file= "ShootWhenStopAuto.xml"/>

<primitive id= "DRIVE_PATH_PLANNER"
pathname= "RedPodiumWing1Center2_B"
time= "6.5"
noteOption="STATE_FEEDER_INTAKE"/>

<snippet file= "ShootWhenStopAuto.xml"/>

<primitive id= "DRIVE_PATH_PLANNER"
pathname= "RedPodiumWing1Center2_C"
time= "6.5"
noteOption= "STATE_FEEDER_INTAKE"/>

<snippet file= "ShootWhenStopAuto.xml"/>


</auton>