<?xml version="1.0" encoding="UTF-8"?>
<!DOCTYPE auton SYSTEM "auton.dtd">
<auton>

<primitive id= "RESET_POSITION_PATH_PLANNER"
pathname= "BlueAmpWing2Center2Start"
noteOption="STATE_READY_ODOMETRY_LAUNCH"/>

<primitive id= "DRIVE_PATH_PLANNER"
pathname= "BlueAmpWing2Center2Start"
noteOption="STATE_READY_ODOMETRY_LAUNCH"
time= "1.0"/>

<snippet file= "ShootWhenStopAuto.xml"/>

<primitive id= "DRIVE_PATH_PLANNER"
pathname= "BlueAmpWing2Center2_A"
noteOption= "STATE_FEEDER_INTAKE"
time= "2.5"
visionAligment = "SPEAKER"/>

<snippet file= "ShootWhenStopAuto.xml"/>

<primitive id= "DRIVE_PATH_PLANNER"
pathname= "BlueAmpWing2Center2_B"
noteOption= "STATE_FEEDER_INTAKE"
time= "2.0"
pathUpdateOption = "NOTE"/>

<snippet file= "ShootWhenStopAuto.xml"/>

<primitive id= "DRIVE_PATH_PLANNER"
pathname= "BlueAmpWing2Center2_C"
noteOption= "STATE_FEEDER_INTAKE"
time="2.0"
visionAligment = "SPEAKER"/>

<primitive id= "DRIVE_PATH_PLANNER"
pathname= "DRIVE_TO_NOTE"
visionAligment= "NOTE"
noteOption= "STATE_FEEDER_INTAKE"
time= "2.5"/>

<primitive id= "DRIVE_PATH_PLANNER"
pathname= "BlueAmpWing2Center2_D"
noteOption= "STATE_READY_ODOMETRY_LAUNCH"
time= "2.5"
pathUpdateOption = "NOTE"/>

<snippet file= "ShootWhenStopAuto.xml"/>


<primitive id= "DRIVE_PATH_PLANNER"
pathname= "BlueAmpWing2Center2_E"
noteOption= "STATE_READY_ODOMETRY_LAUNCH"
time= "2.5"
pathUpdateOption = "NOTE"
visionAligment= "SPEAKER"/>

<snippet file= "ShootWhenStopAuto.xml"/>

</auton>